{
  "schema": "urn:algaguard:schema:mqtt:ota-status:v1",
  "schemaVersion": "1.0.0",
  "messageId": "dc793516-7e1a-4508-bbbe-e81043a56c01",
  "deviceId": "AG-000001",
  "sentAt": "2026-07-22T11:02:00Z",
  "payload": {
    "releaseId": "44444444-4444-4444-8444-444444444444",
    "status": "VERIFIED",
    "progressPercent": 70,
    "downloadedBytes": 1048576,
    "reportedAt": "2026-07-22T11:02:00Z",
    "runningVersion": "0.0.0-contract-demo"
  }
}
