{
  "schema": "urn:algaguard:schema:mqtt:device-health:v1",
  "schemaVersion": "1.0.0",
  "messageId": "4304c751-3c5a-4e3a-8100-b8ddce090b01",
  "deviceId": "AG-000001",
  "sentAt": "2026-07-22T10:00:12Z",
  "payload": {
    "firmwareVersion": "0.0.0-contract-demo",
    "hardwareModel": "ESP32-S3-DEVKITC-1-N16R8",
    "uptimeSeconds": "3600",
    "freeHeapBytes": 210000,
    "freePsramBytes": 7340032,
    "detectedFlashBytes": 16777216,
    "detectedPsramBytes": 8388608,
    "wifiRssiDbm": -58,
    "networkState": "ONLINE",
    "mqttConnected": true,
    "sdPresent": true,
    "sdHealthy": true,
    "sdFreeBytes": 30000000000,
    "rtcValid": true,
    "timestampQuality": "NTP_SYNCED",
    "lastTimeSyncAt": "2026-07-22T09:55:00Z",
    "batteryPercent": 82,
    "batteryVoltageV": 11.8,
    "chargingState": "NOT_CHARGING",
    "externalPowerPresent": false,
    "activeProfile": {
      "profileId": "11111111-1111-4111-8111-111111111111",
      "profileVersion": "1.0.0"
    },
    "lastTelemetrySequence": "1010"
  }
}
